### ISSUE TITLE
LeoReplay example doesnt work

### ISSUE THREAD

**Issue by mhai247** [SpaceNetLab/LeoCC#1]
I'm trying to reproduce the result in the paper, starting from running the environment. I followed the instructions in the README and then ran the example environment. However, the environment did not seem to work; this is the log of the running
(I have echoed the iperf and mmdelay commands to debug)
(I replaced my real home dir with $HOME)
```
iperf3 -s -D > $HOME/LeoCC/leoreplayer/replayer/example/Cubic/iperf3.log 2>&1
mm-delay 10 $HOME/LeoCC/leoreplayer/replayer/example/Cubic/delay_example.txt mm-loss uplink 0.002 mm-link $HOME/LeoCC/leoreplayer/replayer/example/Cubic/bw_example.txt $HOME/LeoCC/leoreplayer/replayer/example/Cubic/bw_example.txt --uplink-queue droptail --uplink-queue-args packets=50000 --downlink-queue droptail --downlink-queue-args packets=50000
Network Interface Created ...
tcpdump: listening on delay-256207, link-type RAW (Raw IP), snapshot length 66 bytes
iperf3 -c 100.64.0.1 -C cubic -t 100 >> $HOME/LeoCC/leoreplayer/replayer/example/Cubic/iperf3_client.log 2>&1
tcpdump: listening on ingress, link-type RAW (Raw IP), snapshot length 66 bytes
29 packets captured
29 packets received by filter
0 packets dropped by kernel
30 packets captured
30 packets received by filter
0 packets dropped by kernel
```

The log seems not to have any problem, but the iperf output gotan  error
```
- - - - - - - - - - - - - - - - - - - - - - - - -
[ ID] Interval           Transfer     Bitrate         Retr
iperf3: error - unable to send control message: Bad file descriptor
```
I also tried to replace the iperf command with ping, but still got no result.
```
PING 100.64.0.1 (100.64.0.1) 56(84) bytes of data.

--- 100.64.0.1 ping statistics ---
433 packets transmitted, 0 received, 100% packet loss, time 442407ms
```
My environment is Ubuntu 22.04.
Btw, I also tried to install and run mahimahi from the original source, and it worked as normal.
Do you have any idea what happened?

**Comment by likie0** [comment]
Can you provide some detailed information? For example, using the commands below to show pcaps' detail
```
tcpdump -r n1.pcap
tcpdump -r n2.pcap
```

**Comment by mhai247** [comment]
n1.pcap
```
reading from file n1.pcap, link-type RAW (Raw IP), snapshot length 66
15:00:16.703624 IP6 fe80::dcbc:9ed7:1b9a:ae14 > ff02::16: HBH ICMP6, multicast listener report v2, 1 group record(s), length 28
15:00:16.703634 IP6 fe80::dcbc:9ed7:1b9a:ae14 > ip6-allrouters: ICMP6, router solicitation, length 8
15:00:16.703636 IP6 fe80::dcbc:9ed7:1b9a:ae14 > ff02::16: HBH ICMP6, multicast listener report v2, 1 group record(s), length 28
15:00:16.967526 IP6 fe80::986d:e7e7:dd4:7670 > ff02::16: HBH ICMP6, multicast listener report v2, 1 group record(s), length 28
15:00:16.967545 IP6 fe80::986d:e7e7:dd4:7670 > ip6-allrouters: ICMP6, router solicitation, length 8
15:00:16.970495 IP6 fe80::986d:e7e7:dd4:7670 > ff02::16: HBH ICMP6, multicast listener report v2, 1 group record(s), length 28
15:00:17.396803 IP6 fe80::dcbc:9ed7:1b9a:ae14 > ff02::16: HBH ICMP6, multicast listener report v2, 1 group record(s), length 28
15:00:17.396812 IP6 fe80::dcbc:9ed7:1b9a:ae14 > ff02::16: HBH ICMP6, multicast listener report v2, 1 group record(s), length 28
15:00:17.583416 IP6 fe80::986d:e7e7:dd4:7670 > ff02::16: HBH ICMP6, multicast listener report v2, 1 group record(s), length 28
15:00:17.583421 IP6 fe80::986d:e7e7:dd4:7670 > ff02::16: HBH ICMP6, multicast listener report v2, 1 group record(s), length 28
15:00:17.711495 IP 100.64.0.6.56376 > 100.64.0.1.5201: Flags [S], seq 4116855825, win 64240, options [mss 1460,sackOK,TS val 532198576 ecr 0,nop,wscale 7], length 0
15:00:18.735484 IP 100.64.0.6.56376 > 100.64.0.1.5201: Flags [S], seq 4116855825, win 64240, options [mss 1460,sackOK,TS val 532199600 ecr 0,nop,wscale 7], length 0
15:00:19.759414 IP 100.64.0.6.56376 > 100.64.0.1.5201: Flags [S], seq 4116855825, win 64240, options [mss 1460,sackOK,TS val 532200624 ecr 0,nop,wscale 7], length 0
15:00:20.655480 IP6 fe80::986d:e7e7:dd4:7670 > ip6-allrouters: ICMP6, router solicitation, length 8
15:00:20.658683 IP6 fe80::dcbc:9ed7:1b9a:ae14 > ip6-allrouters: ICMP6, router solicitation, length 8
15:00:20.783404 IP 100.64.0.6.56376 > 100.64.0.1.5201: Flags [S], seq 4116855825, win 64240, options [mss 1460,sackOK,TS val 532201648 ecr 0,nop,wscale 7], length 0
15:00:21.807448 IP 100.64.0.6.56376 > 100.64.0.1.5201: Flags [S], seq 4116855825, win 64240, options [mss 1460,sackOK,TS val 532202672 ecr 0,nop,wscale 7], length 0
15:00:23.855357 IP 100.64.0.6.56376 > 100.64.0.1.5201: Flags [S], seq 4116855825, win 64240, options [mss 1460,sackOK,TS val 532204720 ecr 0,nop,wscale 7], length 0
15:00:27.887479 IP 100.64.0.6.56376 > 100.64.0.1.5201: Flags [S], seq 4116855825, win 64240, options [mss 1460,sackOK,TS val 532208752 ecr 0,nop,wscale 7], length 0
15:00:28.271474 IP6 fe80::986d:e7e7:dd4:7670 > ip6-allrouters: ICMP6, router solicitation, length 8
15:00:28.787801 IP6 fe80::dcbc:9ed7:1b9a:ae14 > ip6-allrouters: ICMP6, router solicitation, length 8
15:00:35.951491 IP 100.64.0.6.56376 > 100.64.0.1.5201: Flags [S], seq 4116855825, win 64240, options [mss 1460,sackOK,TS val 532216816 ecr 0,nop,wscale 7], length 0
15:00:43.119457 IP6 fe80::986d:e7e7:dd4:7670 > ip6-allrouters: ICMP6, router solicitation, length 8
15:00:44.658511 IP6 fe80::dcbc:9ed7:1b9a:ae14 > ip6-allrouters: ICMP6, router solicitation, length 8
15:00:52.335471 IP 100.64.0.6.56376 > 100.64.0.1.5201: Flags [S], seq 4116855825, win 64240, options [mss 1460,sackOK,TS val 532233200 ecr 0,nop,wscale 7], length 0
15:01:12.304471 IP6 fe80::986d:e7e7:dd4:7670 > ip6-allrouters: ICMP6, router solicitation, length 8
15:01:15.890627 IP6 fe80::dcbc:9ed7:1b9a:ae14 > ip6-allrouters: ICMP6, router solicitation, length 8
15:01:24.591481 IP 100.64.0.6.56376 > 100.64.0.1.5201: Flags [S], seq 4116855825, win 64240, options [mss 1460,sackOK,TS val 532265456 ecr 0,nop,wscale 7], length 0
15:02:08.623437 IP6 fe80::986d:e7e7:dd4:7670 > ip6-allrouters: ICMP6, router solicitation, length 8
15:02:20.915760 IP6 fe80::dcbc:9ed7:1b9a:ae14 > ip6-allrouters: ICMP6, router solicitation, length 8
```
n2.pcap
```
reading from file n2.pcap, link-type RAW (Raw IP), snapshot length 66
15:00:16.724190 IP 100.64.0.2.56376 > 100.64.0.1.5201: Flags [S], seq 4116855825, win 64240, options [mss 1460,sackOK,TS val 532197541 ecr 0,nop,wscale 7], length 0
15:00:16.767435 IP6 fe80::c312:daec:e96d:55da > ff02::16: HBH ICMP6, multicast listener report v2, 1 group record(s), length 28
15:00:16.767442 IP6 fe80::c312:daec:e96d:55da > ip6-allrouters: ICMP6, router solicitation, length 8
15:00:16.770397 IP6 fe80::c312:daec:e96d:55da > ff02::16: HBH ICMP6, multicast listener report v2, 1 group record(s), length 28
15:00:17.041617 IP6 fe80::362a:ec15:3464:1b39 > ff02::16: HBH ICMP6, multicast listener report v2, 1 group record(s), length 28
15:00:17.041649 IP6 fe80::362a:ec15:3464:1b39 > ip6-allrouters: ICMP6, router solicitation, length 8
15:00:17.044794 IP6 fe80::362a:ec15:3464:1b39 > ff02::16: HBH ICMP6, multicast listener report v2, 1 group record(s), length 28
15:00:17.224485 IP6 fe80::362a:ec15:3464:1b39 > ff02::16: HBH ICMP6, multicast listener report v2, 1 group record(s), length 28
15:00:17.519558 IP6 fe80::c312:daec:e96d:55da > ff02::16: HBH ICMP6, multicast listener report v2, 1 group record(s), length 28
15:00:17.711515 IP6 fe80::c312:daec:e96d:55da > ff02::16: HBH ICMP6, multicast listener report v2, 1 group record(s), length 28
15:00:17.728381 IP 100.64.0.2.56376 > 100.64.0.1.5201: Flags [S], seq 4116855825, win 64240, options [mss 1460,sackOK,TS val 532198576 ecr 0,nop,wscale 7], length 0
15:00:17.911874 IP6 fe80::362a:ec15:3464:1b39 > ff02::16: HBH ICMP6, multicast listener report v2, 1 group record(s), length 28
15:00:18.747916 IP 100.64.0.2.56376 > 100.64.0.1.5201: Flags [S], seq 4116855825, win 64240, options [mss 1460,sackOK,TS val 532199600 ecr 0,nop,wscale 7], length 0
15:00:19.772968 IP 100.64.0.2.56376 > 100.64.0.1.5201: Flags [S], seq 4116855825, win 64240, options [mss 1460,sackOK,TS val 532200624 ecr 0,nop,wscale 7], length 0
15:00:20.796052 IP 100.64.0.2.56376 > 100.64.0.1.5201: Flags [S], seq 4116855825, win 64240, options [mss 1460,sackOK,TS val 532201648 ecr 0,nop,wscale 7], length 0
15:00:21.615472 IP6 fe80::c312:daec:e96d:55da > ip6-allrouters: ICMP6, router solicitation, length 8
15:00:21.625734 IP6 fe80::362a:ec15:3464:1b39 > ip6-allrouters: ICMP6, router solicitation, length 8
15:00:21.820957 IP 100.64.0.2.56376 > 100.64.0.1.5201: Flags [S], seq 4116855825, win 64240, options [mss 1460,sackOK,TS val 532202672 ecr 0,nop,wscale 7], length 0
15:00:23.870690 IP 100.64.0.2.56376 > 100.64.0.1.5201: Flags [S], seq 4116855825, win 64240, options [mss 1460,sackOK,TS val 532204720 ecr 0,nop,wscale 7], length 0
15:00:27.904162 IP 100.64.0.2.56376 > 100.64.0.1.5201: Flags [S], seq 4116855825, win 64240, options [mss 1460,sackOK,TS val 532208752 ecr 0,nop,wscale 7], length 0
15:00:30.319443 IP6 fe80::c312:daec:e96d:55da > ip6-allrouters: ICMP6, router solicitation, length 8
15:00:30.331736 IP6 fe80::362a:ec15:3464:1b39 > ip6-allrouters: ICMP6, router solicitation, length 8
15:00:35.965194 IP 100.64.0.2.56376 > 100.64.0.1.5201: Flags [S], seq 4116855825, win 64240, options [mss 1460,sackOK,TS val 532216816 ecr 0,nop,wscale 7], length 0
15:00:47.215567 IP6 fe80::c312:daec:e96d:55da > ip6-allrouters: ICMP6, router solicitation, length 8
15:00:47.226845 IP6 fe80::362a:ec15:3464:1b39 > ip6-allrouters: ICMP6, router solicitation, length 8
15:00:52.351159 IP 100.64.0.2.56376 > 100.64.0.1.5201: Flags [S], seq 4116855825, win 64240, options [mss 1460,sackOK,TS val 532233200 ecr 0,nop,wscale 7], length 0
15:01:23.567566 IP6 fe80::c312:daec:e96d:55da > ip6-allrouters: ICMP6, router solicitation, length 8
15:01:23.578799 IP6 fe80::362a:ec15:3464:1b39 > ip6-allrouters: ICMP6, router solicitation, length 8
15:01:24.608222 IP 100.64.0.2.56376 > 100.64.0.1.5201: Flags [S], seq 4116855825, win 64240, options [mss 1460,sackOK,TS val 532265456 ecr 0,nop,wscale 7], length 0
```

**Comment by mhai247** [comment]
I realized that another app was using that subnet. I changed the default IP of the LeoReplay code, and it works now. Thank you!
